screen_name,created_at,text,id
nippon_en,2015-10-06T01:00:00,"RT @misssaxbys: Toyota at #6 on top global brands, Nintendo dropped for first time http://t.co/SUj02CxKvL http://t.co/bhivN2Ou6L",651200440093159424
nippon_en,2015-10-06T21:00:00,Ōmura Satoshi Wins Quarter Share of Medicine Nobel http://t.co/EQLLjpVq1B http://t.co/C8Mtku7AtG,651502234023276544
nippon_en,2015-10-06T22:00:00,Ōmura Satoshi’s Art Museum: A Nobel Winner’s Generosity http://t.co/86VfssXjCG http://t.co/F32oTB5tCC,651517316694282240
nippon_en,2015-10-07T00:20:00,In Pursuit of Good Governance: An Interview with Murakami Aya of C&amp;I Holdings http://t.co/Ol1zUwIf7d http://t.co/9a4r3es8uT,651552745078435844
nippon_en,2015-10-07T00:56:00,Some amazing diorama models by a high school student (see more at @arukaido). http://t.co/FhfKHCXmhU,651561766111997952
nippon_en,2015-10-07T01:25:00,"In 2013, there were 21,488 international marriages in Japan (1 in 30 of all marriages). http://t.co/EgpwpnafOV http://t.co/Sg3sbu9Ocb",651568889675972608
nippon_en,2015-10-07T01:59:00,Higanbana (spider lilies) by saya2926 (https://t.co/y9f9u4XDLI). http://t.co/5LAycBt7Rf,651577602415591424
nippon_en,2015-10-07T02:31:00,Ōmura Satoshi won the Medicine Nobel for his discovery of microbes that have helped to combat parasitic diseases. http://t.co/EQLLjpVq1B,651585499929317376
nippon_en,2015-10-07T04:59:00,Japan’s First Female Photojournalist is Still Shooting at the Age of 101 http://t.co/WAHqL3rhd2,651622889548963840
nippon_en,2015-10-07T05:52:00,A Russian expert on Japan shares his theory about who wrote Article 9 of the 1947 Constitution of Japan. http://t.co/ZaUD3wCr06,651636293055594497
nippon_en,2015-10-07T07:12:00,"As fall deepens, Japan's forests take on spectacular red, orange, and yellow hues. http://t.co/h5wpmtdsqv http://t.co/I5g0plc7lN",651656345788133376
nippon_en,2015-10-07T12:58:00,Kajita Takaaki Wins Physics Nobel for Work on Neutrinos: http://t.co/r8ftvnOLz4 http://t.co/toyyTlAAwj,651743289465372673
nippon_en,2015-10-07T16:00:00,In Pursuit of Good Governance: An Interview with Murakami Aya of C&amp;I Holdings http://t.co/Ol1zUwIf7d http://t.co/ctfMgJjIef,651789149658214402
nippon_en,2015-10-07T17:00:00,"Mount Fuji's abiding presence in Japanese art, culture, and history. http://t.co/xZYT5DwoLl http://t.co/WiIQzblLJZ",651804228348874752
nippon_en,2015-10-08T00:18:00,Kajita Takaaki Wins Physics Nobel for Work on Neutrinos http://t.co/r8ftvnOLz4 http://t.co/5fHAdKC8P4,651914626674769920
nippon_en,2015-10-08T00:33:00,Government Fails to Address Contradictions Over Japan’s Nuclear Future http://t.co/Q2I68l5ava http://t.co/SVEHKm9PDz,651918423354572800
nippon_en,2015-10-08T01:26:00,Sumō comedy... (via @nemaoffice) http://t.co/HUqDv4E4xm,651931695013167104
nippon_en,2015-10-08T02:01:00,"JHS student murder highlights Japan’s need to deal with issues of single-parent households, poverty, and immigration http://t.co/HxFjlw6BPM",651940485913669633
nippon_en,2015-10-08T04:38:00,"Today is ""Tabi Day"" in Japan! Pics via akaitori https://t.co/GS4qQxtUwq and tonko43 https://t.co/rU0ayo00Za http://t.co/HqoKiwn0cB",651979954373050368
nippon_en,2015-10-08T05:37:00,"Although not clearly permitted by law, pachinko is Japan’s favorite form of gambling. http://t.co/ZB0CSaBKcA http://t.co/xVol9gX6Nj",651994867288031232
nippon_en,2015-10-08T07:00:00,"On the island of Hirado in Nagasaki Prefecture, there are many Christian churches. http://t.co/c1YsuCSdPc http://t.co/ptZoFLZ4iH",652015590521991168
nippon_en,2015-10-08T08:17:00,Kajita Takaaki shares this year's physics Nobel for the discovery that neutrinos have mass. http://t.co/r8ftvnOLz4 http://t.co/z11fYQH8wa,652035033612484608
nippon_en,2015-10-08T16:00:00,Government Fails to Address Contradictions Over Japan’s Nuclear Future http://t.co/Q2I68l5ava http://t.co/WPkFqiY71o,652151538715004928
nippon_en,2015-10-08T17:00:00,"Single mothers in Japan face gender discrimination, growing poverty, and income inequality. http://t.co/izf7CBPrkO http://t.co/qm6LZtA6JX",652166628906369024
nippon_en,2015-10-09T00:23:00,"Even if fertility rate rises to 2.07, Japan's population is projected to shrink significantly http://t.co/3UrUJXclUs http://t.co/4m8vfjtSlN",652278157760856064
nippon_en,2015-10-09T01:13:00,Tokyo’s Multiplying Ethnic Enclaves http://t.co/lSnqw13SGc http://t.co/3RWSdooLXZ,652290641662095361
nippon_en,2015-10-09T02:21:00,Father of Four Tasked With Halting Japan's Population Decline http://t.co/jmbJfzrO6R,652307803143467008
nippon_en,2015-10-09T03:17:00,Daughter of one of Japan's first activist shareholders is carrying on the family business. http://t.co/Ol1zUwIf7d http://t.co/u6jqbaQuLc,652322024526778369
nippon_en,2015-10-09T07:05:00,The political tussle between Japan and S Korea over Meiji industrial heritage sites. http://t.co/bJPodR45c5 http://t.co/HNPpOiOam4,652379427829997568
nippon_en,2015-10-09T17:00:00,"A horde of ""manekineko"" (lucky, beckoning cats) can be found at a Tokyo temple. http://t.co/chqzJRPQ22 http://t.co/Gd7OgUCZIH",652529015408869377
nippon_en,2015-10-10T01:06:00,Romantic Aspirations: Japan’s “Gōkon” Group Dating http://t.co/kWJBufOXuk http://t.co/R7JXel462g,652651489911959552
nippon_en,2015-10-10T04:00:00,"In seeking to boost its birthrate, Japan could learn from France. http://t.co/3sffCW4yPw http://t.co/NFl1Ie2zmr",652695081971920896
nippon_en,2015-10-10T05:00:00,Japanese firms need to adopt a multidimensional governance model that takes into consideration all stakeholders. http://t.co/iFNRLYK8pp,652710174738616325
nippon_en,2015-10-10T06:00:00,Recent developments in the East China Sea could escalate tensions between China and Japan. http://t.co/mzhQySt963 http://t.co/odOGsiJZfZ,652725271901016064
nippon_en,2015-10-10T16:00:00,Romantic Aspirations: Japan’s “Gōkon” Group Dating #japanglances http://t.co/kWJBufOXuk http://t.co/caLsSU84BL,652876310377709568
nippon_en,2015-10-10T17:00:00,How could 18- and 19-year-old voters affect the political landscape in Japan? http://t.co/goozSL3qaS http://t.co/XHIkv4oJKZ,652891381535367169
nippon_en,2015-10-11T04:00:00,"What is life like for Japan's single mothers?
http://t.co/izf7CBPrkO http://t.co/ZBVWnugoLv",653057447381200896
nippon_en,2015-10-11T05:00:00,"In 2007, Nobel winner Ōmura Satoshi donated numerous artworks and a museum to house them to his home city. http://t.co/86VfssXjCG",653072564760088576
nippon_en,2015-10-11T17:00:00,"If you're visiting Japan, here's some information on staying connected after you arrive. http://t.co/0LOEfV0Xnq http://t.co/RmRTqN5pQX",653253758827151361
nippon_en,2015-10-12T01:14:00,“Kyaraben” (Character “Bentōs”) #japanglances http://t.co/z3WZW0KAlP http://t.co/1vEiFTlqnm,653378214945943552
nippon_en,2015-10-12T04:00:00,"It's Health and Sports Day! Have a healthy and/or sporty day.&gt; More on national holidays.
http://t.co/wshSWcW3RZ http://t.co/GJBmMyP2NY",653419840066056192
nippon_en,2015-10-12T05:00:00,"If government plans to continue using nuclear power, it should replace aging facilities. http://t.co/Q2I68l5ava http://t.co/S0kruvm7Ho",653434931285069825
nippon_en,2015-10-12T06:00:00,The minaret of Japan’s biggest mosque Tokyo Camii against the Shinjuku skyline. http://t.co/PdEe8ixTza http://t.co/3BWwO2RzD4,653450052443070464
nippon_en,2015-10-12T16:00:00,“Kyaraben” (Character “Bentōs”) #japanglances http://t.co/z3WZW0KAlP http://t.co/jR6KrwWzPA,653601092693921793
nippon_en,2015-10-13T00:27:00,Sounds to See and Feel: Japanese Onomatopoeia and Beyond http://t.co/rbf8qPYJTg http://t.co/R6Duqw2Frm,653728841802760192
nippon_en,2015-10-13T00:42:00,Revitalizing Rural Japan: the Echigo-Tsumari Art Triennale http://t.co/xfrzb68w0R http://t.co/jVAxIaXvWg,653732388279746564
nippon_en,2015-10-13T01:18:00,Red sky and Skytree (by m_scape https://t.co/cqgNfgk4Iu). http://t.co/f1kI7mSf61,653741482059304960
nippon_en,2015-10-13T02:01:00,"A history of Japanese animation, from its beginnings in 1917. http://t.co/p0H4567G9J http://t.co/V9thsbVxqx",653752314642063361
nippon_en,2015-10-13T04:37:00,More and more foreign communities have been springing up in Tokyo. http://t.co/lSnqw13SGc http://t.co/NODeZwbTtQ,653791545338937345
nippon_en,2015-10-13T05:34:00,Tentacle scrunchie. http://t.co/uiXzPeA9pZ,653805898951856128
nippon_en,2015-10-13T06:42:00,"A Taiwanese, Italian, and Vietnamese student talk about living and studying in Japan. http://t.co/f3N3wNQzgd http://t.co/qYJCZfvRbJ",653823130398384128
nippon_en,2015-10-13T08:35:00,"""Gōkon"" group dating is a popular way for Japanese singles to meet and get to know each other http://t.co/kWJBufOXuk http://t.co/C4VO7n3sZa",653851451840589824
nippon_en,2015-10-13T16:00:00,Sounds to See and Feel: Japanese Onomatopoeia and Beyond http://t.co/rbf8qPYJTg http://t.co/TQcJMc8Jtg,653963460326244352
nippon_en,2015-10-13T17:00:00,“Kōyō” (Autumn Foliage) #japanglances http://t.co/h5wpmtdsqv http://t.co/Du2gkmhfbh,653978570415452160
nippon_en,2015-10-13T18:00:00,Revitalizing Rural Japan: the Echigo-Tsumari Art Triennale http://t.co/xfrzb68w0R http://t.co/o3ibTlkzub,653993659549937664
nippon_en,2015-10-14T00:27:00,The Sloppy and Unconstitutional Revision of the Public Offices Election Law http://t.co/hOhrT90dIX http://t.co/NUJozchsot,654091084121796608
nippon_en,2015-10-14T00:51:00,Today the BBC launched a Japanese language website. http://t.co/9zezUREQ2r,654097277733044224
nippon_en,2015-10-14T01:44:00,Plug your headphones into this Google Play ad in Shibuya and you can listen to music. (via @runfishing_waka) http://t.co/Rnh6LFwkyG,654110541317713920
nippon_en,2015-10-14T02:03:00,"RT @oldpicsarchive: Subway Tokyo poster, 1927 http://t.co/HRRuY5RB38",654115301273931776
nippon_en,2015-10-14T03:07:00,"Cat-collecting game ""Nekoatsume"" has won fans around the world this year. http://t.co/u6xgmNfV1Z http://t.co/TqEvP4grx9",654131326920994818
nippon_en,2015-10-14T03:11:00,How many cats do you have? #nekoatsume http://t.co/m3PqOu6oEd,654132277845225476
nippon_en,2015-10-14T04:50:00,A huge area of Japanese vocabulary that does not use kanji. http://t.co/rbf8qPYJTg http://t.co/l0kxAFuTlE,654157224508420097
nippon_en,2015-10-14T06:07:00,"With high-end stores and restaurants, Ginza showcases the best of Japan in one small area. http://t.co/yDd0lCCiPQ http://t.co/P3juyQAOPz",654176751573012480
nippon_en,2015-10-14T06:14:00,One of many great pictures at the _tuck4 Instagram account. https://t.co/x6pD0P8oXt http://t.co/iRJ3OfW5dA,654178352396308480
nippon_en,2015-10-14T06:53:00,Gundam on the cover of Nikkei Business magazine. http://t.co/PyaVPJcceP,654188253843619840
nippon_en,2015-10-14T08:07:00,"Murai Jun, who played a key role in the development of the Internet in Japan, looks back on its evolution. http://t.co/x72YnownaK",654206791236976641
nippon_en,2015-10-14T08:08:00,Blast from the past: kids enjoy a train ride at Ueno Zoo. (via @TokyoZooNet_PR) https://t.co/IZHSeQq0uf,654207151049588736
nippon_en,2015-10-14T08:39:00,"""What do you mean, you're out of salmon bentōs?"" (via @ikomahatensi) http://t.co/BjHtbtyxiV",654215042691272704
nippon_en,2015-10-14T17:00:00,Empress Michiko (left) is a role model for Princess Kako (right) and other younger royals. http://t.co/xsVtjJnqvu http://t.co/BBQm5uko97,654340949103906816
nippon_en,2015-10-14T18:00:00,Way of the Sword Remains Exclusive: Kendō’s Largely Local Appeal http://t.co/yOr4n4c8dS http://t.co/a9EZQxHnOb,654356056911417344
nippon_en,2015-10-15T00:37:00,Thomas Glover: The Scotsman Who Helped Meiji Japan Modernize http://t.co/Rv0BLurv1F http://t.co/97c5Xb4VuW,654455938481389568
nippon_en,2015-10-15T01:11:00,"Yakushima, Japan: an island of natural wonders http://t.co/pECLAdRjUK http://t.co/ysp9dSM1bm",654464485416022016
nippon_en,2015-10-15T01:45:00,Japan has one of the highest relative poverty rates for any developed country. http://t.co/4ZHxdPMcKX http://t.co/d5PnRiTsUQ,654473173958692864
nippon_en,2015-10-15T02:39:00,"Retro handsets for smartphones. (via @love_tktr)
http://t.co/c13HFc54RT",654486684466196481
nippon_en,2015-10-15T03:29:00,Kendō (the way of the sword) has yet to win the same global popularity as jūdō and karate. http://t.co/yOr4n4c8dS http://t.co/DHVkVpMr6A,654499183781502976
nippon_en,2015-10-15T04:35:00,"Former American POWs visit Japan, recount memories http://t.co/aKwZzWfOBn",654515963056885760
nippon_en,2015-10-15T06:26:00,"Before robots, Japan had mechanical dolls that served tea or climbed down stairs. http://t.co/oPwU83BDOj http://t.co/lMVdWgPyQP",654543792033234948
nippon_en,2015-10-15T09:09:00,RT @SkyNews: Here's what happened when @BorisJohnson played rugby against some ten-year-olds in Japan http://t.co/kDPD1qhiaA,654584767858388993
nippon_en,2015-10-15T16:00:00,Thomas Glover: The Scotsman Who Helped Meiji Japan Modernize http://t.co/Rv0BLurv1F http://t.co/qfFYn2JVlE,654688253778366466
nippon_en,2015-10-15T17:00:00,The recent history of LGBT rights in Japan. http://t.co/aDy9vTjV6y http://t.co/4MT41No3z0,654703353859932160
nippon_en,2015-10-16T00:28:00,Japan’s Restless Volcanoes http://t.co/Qi61WbF7qu http://t.co/MU0YikDsd9,654816088480350209
nippon_en,2015-10-16T00:46:00,Japan’s 72 Microseasons http://t.co/DGSjl0sSd1 http://t.co/dnMQWoliBs,654820664520540160
nippon_en,2015-10-16T01:03:00,Japan wins non-permanent seat on the UN Security Council. http://t.co/XGMaSsyuDE,654824890881609728
nippon_en,2015-10-16T01:34:00,"RT @pochanuk: R2-D2 at a shop called Tokyu Hands in Japan, built by one of the customers. #R2D2 #StarWars #CoolJapan https://t.co/0WlROSCJmr",654832842078183424
nippon_en,2015-10-16T01:58:00,Adventures in Japanese cuisine: a bowl of soba topped w/a deep-fried citrus/ginger apple pie (via @tonic_news_mass) http://t.co/Mal01FiLmQ,654838720881778688
nippon_en,2015-10-16T05:27:00,Thomas Glover was a Scottish merchant who played a major role in Japan's industrialization. http://t.co/Rv0BLurv1F http://t.co/p24LlamcAW,654891500485001216
nippon_en,2015-10-16T06:26:00,"""Smooth Criminal"" on traditional Japanese instruments. https://t.co/BonCuKyQVu",654906361902305280
nippon_en,2015-10-16T07:39:00,@kinokuniyanet Thanks for pointing that out. We will correct it.,654924509275754496
nippon_en,2015-10-16T08:00:00,Where Chinese residents live in Tokyo. http://t.co/R0lEuovoMp [corrected] http://t.co/XPk0TFS363,654929867423682562
nippon_en,2015-10-16T08:03:00,@kinokuniyanet Thanks again. We fixed a couple of other errors on the map too.,654930619785285632
nippon_en,2015-10-16T08:17:00,@kankiknight This means PRC passport holders. See 14-12-05-1 and 14-12-07 here: http://t.co/oCwPlEuAhY,654934083777073152
nippon_en,2015-10-16T08:51:00,"@kankiknight Japan has relatively low barriers to naturalization, though. In any case counting by passport is all the authorities can do.",654942782956531713
nippon_en,2015-10-16T16:00:00,Japan’s Restless Volcanoes http://t.co/Qi61WbF7qu http://t.co/VHiIQmp9jo,655050652050034688
nippon_en,2015-10-16T17:00:00,"Ōmura Satoshi, Japan's latest Nobel winner, is also known for his art-related philanthropy. http://t.co/86VfssXjCG http://t.co/m2byZNC8vA",655065727804665857
nippon_en,2015-10-17T00:37:00,“Shodō” (Japanese Calligraphy) http://t.co/J1yJaxPO0s http://t.co/jSn3eKZMjr,655180725101031424
nippon_en,2015-10-17T04:00:00,"All about the new Hokuriku Shinkansen service, which links Tokyo to Kanazawa in 2½ hours. http://t.co/gsSkxIjsXj http://t.co/JWmENwbvwb",655231772897054720
nippon_en,2015-10-17T05:00:00,"More than 500,000 visitors attended the Echigo-Tsumari Art Triennale this year. http://t.co/xfrzb68w0R http://t.co/uOAhKB6CGw",655246880205488128
nippon_en,2015-10-17T06:00:00,Japan has scrambled to revamp its cybersecurity strategy in the wake of the pension service hack earlier this year. http://t.co/kPlZiyhay7,655261979121094656
nippon_en,2015-10-17T17:00:00,"In 2013, there were 21,488 international marriages in Japan (1 in 30 of all marriages). http://t.co/EgpwpnafOV http://t.co/giHfgcx867",655428114294571009
nippon_en,2015-10-18T04:00:00,Japan in recent years has idealized the “small face” (kogao) for both women and men. http://t.co/D5dA7SYvqy,655594188579278848
nippon_en,2015-10-18T05:00:00,"New vote disparity bill was little thought out, ignored local concerns, and may even be unconstitutional. http://t.co/hOhrT90dIX",655609268691795969
nippon_en,2015-10-18T06:00:00,An examination of Hiroshima's symbolic status as a peace city and its role in international peace-building efforts. http://t.co/n9FuG5fzXA,655624372267290624
nippon_en,2015-10-19T00:25:00,Why Does Japan Have Butter Shortages? http://t.co/6oKpCcQmpY http://t.co/BFI9loUCDS,655902466349756416
nippon_en,2015-10-19T01:05:00,"An interview with ""Attack on Titan"" creator Isayama Hajime. http://t.co/I3xbCFkXWI",655912547799793664
nippon_en,2015-10-19T01:45:00,"From Western-style beginnings, the ""magical girl"" has become a familiar character in anime. http://t.co/vhswwvMYPz http://t.co/1rkWE8eQhg",655922615689736192
nippon_en,2015-10-19T03:22:00,The All Japan Obachan Party: a Facebook group that gives middle-aged Japanese women a voice http://t.co/dNOrnE3FxI http://t.co/SycmrdXn3s,655947143375536130
nippon_en,2015-10-19T04:48:00,"Cute tear-and-share bread. (via @unia112)
http://t.co/Vjlh1Oc9oF",655968783593398272
nippon_en,2015-10-19T06:08:00,Mourners customarily provide a monetary gift at Japanese funerals. http://t.co/O7cHVlaBJl http://t.co/WimIxuu28a,655988975362965504
nippon_en,2015-10-19T16:00:00,Why Does Japan Have Butter Shortages? http://t.co/6oKpCcQmpY http://t.co/C6NQXbP2AR,656137786248982528
nippon_en,2015-10-19T17:00:00,"Even if fertility rate reaches 2.07, Japan's population projected to shrink significantly. http://t.co/3UrUJXclUs http://t.co/76tYxYgUoN",656152874720714752
nippon_en,2015-10-20T00:24:00,Foreign Visitors to Japan Nearing 20 Million Annually https://t.co/RBhzrzYqbL https://t.co/FAdcmnloqt,656264800981266432
nippon_en,2015-10-20T01:00:00,"Happy Birthday to Empress Michiko, who is 81 today. (This picture is from 1958.) https://t.co/EYYOADruxO",656273685284679680
nippon_en,2015-10-20T01:23:00,Number of kanji test-takers are expected to know at different levels of the Kanji Kentei. https://t.co/aOcbaGhjW5 https://t.co/ykmOaA0GGU,656279430738743296
nippon_en,2015-10-20T02:02:00,What's it like to be black in Japan? https://t.co/vmBJpXv3c2,656289393792016384
nippon_en,2015-10-20T03:30:00,The reasons behind recurring butter shortages in Japan. https://t.co/6oKpCcQmpY https://t.co/ga0zvqJJoE,656311583669293056
nippon_en,2015-10-20T04:37:00,Okinawa currently hosts 74% of American military installations in Japan. https://t.co/FSWsxJeX0r https://t.co/ETDNqP5RD5,656328450962145280
nippon_en,2015-10-20T06:07:00,"In the 19th century, Japanese art captured the attention of leading painters in Europe. https://t.co/TqLqgJU4IV https://t.co/DpBhV04vIw",656350928568651776
nippon_en,2015-10-20T08:15:00,Traditional calendar with 72 microseasons offers a poetic journey through the Japanese year https://t.co/DGSjl0sSd1 https://t.co/uunldmuAnm,656383197031170048
nippon_en,2015-10-20T17:00:00,Romantic Aspirations: Japan’s “Gōkon” Group Dating https://t.co/kWJBufOXuk https://t.co/uhL4jAvd4x,656515304403537920
nippon_en,2015-10-21T00:23:00,The Nobel Discovery Protecting 300 Million People from the Risk of Blindness https://t.co/E53yxy4DZg https://t.co/qDQGXHJ3NN,656626919836749824
nippon_en,2015-10-21T01:31:00,Japan to pay Fukushima worker cancer compensation https://t.co/0PDOeRq3c4,656643960685748224
nippon_en,2015-10-21T01:44:00,"Attention, sweater fans. Here's Charizard flaming Ash and Pikachu. (via @dasasweater) https://t.co/YOWjpR8d5D",656647115192446976
nippon_en,2015-10-21T02:14:00,"In 10 to 30 years, Japan's imperial family could dwindle down to just 5 members. https://t.co/lXht1ROAJO https://t.co/xsgAyKfT1Q",656654828462968833
nippon_en,2015-10-21T04:46:00,Happy 56th Birthday to Watanabe Ken! https://t.co/9rWkfRweOk https://t.co/sOJJcJdah3,656692950194221056
nippon_en,2015-10-21T07:11:00,A surge in small-scale volcanic activity has had Japan on edge. https://t.co/Qi61WbF7qu https://t.co/XFeHfbfco6,656729574470893568
nippon_en,2015-10-21T07:53:00,"On October 21, 1600, Tokugawa Ieyasu's forces won the Battle of Sekigahara, consolidating his power over Japan. https://t.co/4xI0jBBySf",656740197099409408
nippon_en,2015-10-21T08:30:00,"As Chinese economy struggles, the role of Chinese government should be to monitor the market rather than manage it. https://t.co/i91ShQqZMh",656749471871533056
nippon_en,2015-10-21T09:03:00,The knotty problem of US military base relocation in Okinawa and the challenge of Chinese expansionism. https://t.co/QnXiaVoNG6,656757649074089985
nippon_en,2015-10-21T16:00:00,The Nobel Discovery Protecting 300 Million People from the Risk of Blindness https://t.co/E53yxy4DZg https://t.co/KKFy9TNii8,656862568250667008
nippon_en,2015-10-21T17:00:00,Japan's beauty industry is hoping to attract more tourist spending. https://t.co/EZ8qzf1lcR https://t.co/xMMBzrzGLA,656877672677543936
nippon_en,2015-10-22T00:29:00,RT @annafifield: this video of three sumo wrestlers - average weight 418 pounds - sprinting is going viral in Japan (h/t @WSJAsia) https://…,656990695022989312
nippon_en,2015-10-22T00:59:00,The Birth of Culinary Experts and the Evolving Needs of Japanese Housewives https://t.co/IgFtIFaaTR https://t.co/fJN60wohE0,656998293713453056
nippon_en,2015-10-22T01:44:00,"While the number of suicides in Japan has begun to decline recently, figures remain high. https://t.co/4hPVg820w1 https://t.co/fOe0F9wTS5",657009677775953920
nippon_en,2015-10-22T02:17:00,Why Japan wants to transform into a 'hydrogen society' https://t.co/pcaEkor9kn,657018021177782273
nippon_en,2015-10-22T02:55:00,"""Shodō"" (Japanese calligraphy) has won new fans recently as a performance art. https://t.co/J1yJaxPO0s https://t.co/s36Q6gWHFV",657027484676788224
nippon_en,2015-10-22T04:42:00,Lovely autumn leaves in this photo by rrrrei. https://t.co/ZRZmgpohBT https://t.co/trUl1UvcYT,657054467959820289
nippon_en,2015-10-22T05:31:00,Chinese commentator Ma Licheng calls for China to be open-minded in its response to the Abe statement. https://t.co/0gKswcXO2o,657066624822808576
nippon_en,2015-10-22T08:28:00,"Even if you don't think Wi-Fi is quite this important, our Japan Wi-Fi info may be useful! https://t.co/0LOEfV0Xnq https://t.co/Ef6opLao05",657111310132363264
nippon_en,2015-10-22T09:09:00,"19th century picture of ""maiko."" (via https://t.co/OOGOxeE0op) https://t.co/x4MTYuE89s",657121564186378240
nippon_en,2015-10-22T17:00:00,The minaret of Japan’s biggest mosque Tokyo Camii against the Shinjuku skyline. https://t.co/PdEe8ixTza https://t.co/HeDtXNqf64,657240068042571776
nippon_en,2015-10-23T00:32:00,Time to Stop Nursing the Nuclear Power Industry https://t.co/cJeVFDVeE2 https://t.co/p5mQLysdse,657353791843340288
nippon_en,2015-10-23T00:57:00,Monk completes nine-day endurance test https://t.co/5w3Oj6i27O,657360099309043712
nippon_en,2015-10-23T01:38:00,The Starbucks experience in Japan. https://t.co/cMxZJmWVCI https://t.co/PbPjplrh0m,657370585249386497
nippon_en,2015-10-23T02:07:00,"Today marks the beginning of the microseason ""Shimo hajimete furu"" (霜始降) or first frost. https://t.co/bSZNjM7kz3 https://t.co/mZLEUWp2F7",657377870994534400
nippon_en,2015-10-23T02:43:00,"Tourist numbers have soared again this year, and are likely to approach the government's 2020 target of 20 million. https://t.co/RBhzrzYqbL",657386959141076992
nippon_en,2015-10-23T04:33:00,"RT @tofugu: Everything you've ever wanted to know about how to bow, and how not to bow, in Japan. https://t.co/x28uaGDLSu https://t.co/OGFw…",657414407060746240
nippon_en,2015-10-23T05:26:00,There is growing disparity in how mainlanders and Okinawans view the prefecture's issues. https://t.co/AeMteWHB3L,657427921217261568
nippon_en,2015-10-23T06:33:00,Future champion? (via @sumokyokai) https://t.co/KuHk4mpRGj,657444628694609920
nippon_en,2015-10-23T07:14:00,Japanese corporations with North American operations increasingly moving production sites to the South of the US. https://t.co/FbdTJD9b34,657455159501393920
nippon_en,2015-10-23T08:47:00,Kamikōchi in Nagano Prefecture is a great place to see autumn leaves. https://t.co/atkdZwEo7f https://t.co/BZzDFqTJvp,657478496256589825
nippon_en,2015-10-23T16:00:00,Time to Stop Nursing the Nuclear Power Industry https://t.co/cJeVFDVeE2 https://t.co/g4o4SZC8Kn,657587346175492096
nippon_en,2015-10-23T17:00:00,"A history of Japanese animation, from its beginnings in 1917. https://t.co/p0H4567G9J https://t.co/biSjwKHB8w",657602464292540417
nippon_en,2015-10-24T04:00:00,Time for a picnic. https://t.co/eghSeWwPa9 https://t.co/K35jwfh0wz,657768503932358656
nippon_en,2015-10-24T05:00:00,A spoonful of soil from a golf course yielded microbes now being used to battle river blindness and other diseases. https://t.co/E53yxy4DZg,657783589698842625
nippon_en,2015-10-24T06:00:00,The Global Sushi Challenge pits chefs from around the world against each other. https://t.co/CEfTN2ww9K https://t.co/76Qixjb1lU,657798711536259072
nippon_en,2015-10-24T17:00:00,A huge area of Japanese vocabulary that does not use kanji. https://t.co/rbf8qPYJTg https://t.co/WZ3gvjpjkD,657964817374838784
nippon_en,2015-10-25T00:20:00,“Takuhai” Delivery Service #japanglances https://t.co/ZjPIGvXpVy https://t.co/1EUv0ZgHmo,658075750357069824
nippon_en,2015-10-25T04:00:00,Bicycle theft accounts for 29.2% of theft in Japan. https://t.co/fH7CrcdxqH https://t.co/5M0YakMpvY,658130892112551936
nippon_en,2015-10-25T05:00:00,Japan's has had many culinary role models over the years. https://t.co/IgFtIFaaTR https://t.co/eHXRsoOYIG,658145978491367426
